{
  "schemaVersion": "1.0",
  "producedBy": {
    "name": "fixture-producer",
    "version": "0.0.0"
  },
  "runAt": "2026-08-10T09:00:00.000Z",
  "revision": {
    "gitSha": "0000000000000000000000000000000000000000",
    "paths": [
      "index.html",
      "styles.css",
      "src"
    ],
    "sourceIdentity": "00000000000000000000000000000000"
  },
  "run": {
    "status": "completed"
  },
  "viewports": [
    {
      "name": "iphone-14",
      "class": "mobile",
      "width": 390,
      "height": 844
    },
    {
      "name": "laptop",
      "class": "desktop",
      "width": 1440,
      "height": 900
    }
  ],
  "routes": [
    {
      "route": "/",
      "status": "tested",
      "viewportsTested": [
        "iphone-14",
        "laptop"
      ],
      "accessibilityTree": "obtained",
      "checks": [
        {
          "ruleId": "accessibility.contrast",
          "outcome": "inconclusive",
          "viewport": "iphone-14",
          "evidence": "text sat on a background image; no computed pair to compare"
        },
        {
          "ruleId": "accessibility.contrast",
          "outcome": "inconclusive",
          "viewport": "laptop",
          "evidence": "text sat on a background image; no computed pair to compare"
        },
        {
          "ruleId": "design-integrity.no-fake-success",
          "outcome": "passed",
          "viewport": "laptop",
          "evidence": "no success state was shown for a failed request at laptop"
        }
      ],
      "screenshots": []
    },
    {
      "route": "/account",
      "status": "tested",
      "viewportsTested": [
        "iphone-14",
        "laptop"
      ],
      "accessibilityTree": "obtained",
      "checks": [
        {
          "ruleId": "accessibility.contrast",
          "outcome": "inconclusive",
          "viewport": "iphone-14",
          "evidence": "text sat on a background image; no computed pair to compare"
        },
        {
          "ruleId": "accessibility.contrast",
          "outcome": "inconclusive",
          "viewport": "laptop",
          "evidence": "text sat on a background image; no computed pair to compare"
        },
        {
          "ruleId": "design-integrity.no-fake-success",
          "outcome": "passed",
          "viewport": "laptop",
          "evidence": "no success state was shown for a failed request at laptop"
        }
      ],
      "screenshots": []
    }
  ]
}
